成語,解釋,例句,注音,字義,近義詞,反義詞,
充耳不聞,堵住耳朵，假裝沒聽見。形容拒絕聽取別人的意見。,安安知道自己錯了，趕緊向坡坡道歉。但坡坡充耳不聞，不肯理他。,充耳不聞,,不聞不問、馬耳東風、閉目塞聽、置若罔聞,洗耳恭聽,
猝不及防,事情突然發生，來不及應變。,忽然飛來一隻烏鴉，猝不及防的叼走了金牌。,猝不及防,,,,
氣喘吁吁,呼吸急促，氣喘不已的樣子。形容非常勞累。,他們兩個拚命追趕烏鴉，跑得氣喘吁吁。,氣喘吁吁,,,,
物歸原主,物品歸還給原來的主人。,安安把一塊石頭丟過去，嚇得烏鴉扔下金牌逃走了，金牌總算物歸原主。,物歸原主,,完璧歸趙,,
豁然開朗,形容眼前頓時變得明亮又開闊。比喻原來不明白，突然領悟了某個道理。,安安和坡坡鑽過又深又暗的樹洞，眼前豁然開朗。,豁然開朗,豁：開通、開闊。,恍然大悟、茅塞頓開、頓開茅塞、豁然大悟、豁然貫通,一竅不通、大惑不解、百思不解、百思莫解,
豁然開朗,形容眼前頓時變得明亮又開闊。比喻原來不明白，突然領悟了某個道理。,查了這部百科全書，頓時豁然開朗，解決多年的疑惑。,豁然開朗,豁：開通、開闊。,恍然大悟、茅塞頓開、頓開茅塞、豁然大悟、豁然貫通,一竅不通、大惑不解、百思不解、百思莫解,
鄭重其事,形容對待事物的態度非常嚴肅認真。,他們兩個鄭重其事的約定，坡坡要幫助安安成為成語大王。,鄭重其事,,,,
百戰百勝,每次打仗都能獲勝。形容所向無敵。,我們學校的籃球隊在各種比賽中屢屢奪冠，百戰百勝。,百戰百勝,,百戰不殆,,
百依百順,形容事事都順從，毫不違背。,我爸媽的想法開明，家裡的氣氛十分融洽且民主，晚輩不須一味對長輩百依百順。,百依百順,依：依從。順：順從。,言聽計從,,
四通八達,四面八方都有路相通。形容交通非常便利。,這座城市的的地鐵四通八達，交通十分便利。,四通八達,,四會五達、暢通無阻,山重水複、路絕人稀、斷潢絕港,
四平八穩,形容物體擺得很穩。也比喻說話、態度穩當。,他做事四平八穩，但缺乏創意。,四平八穩,,,,
七嘴八舌,形容人多口雜，意見分歧。,這群球迷一邊看球賽，一邊七嘴八舌的發表議論。,七嘴八舌,,議論紛紛,異口同聲,
七手八腳,形容人多手雜，動作不一。也形容眾人一起動手的樣子。,全班同學七手八腳的一起打掃，教室很快就煥然一新。,七手八腳,,手忙腳亂,有條不紊,
一本正經,形容莊重、認真的態度。,詐騙集團常用一本正經的說詞誘使民眾上當，我們一定要提高警覺。,義本正經,正經：端莊正派。,,,
淡妝濃抹,淡妝則顏色素淨，濃抹則色彩豔麗。用於形容風光景致，也指女子裝扮。,阿姨身材高挑，皮膚細白光滑，不論淡妝濃抹都很漂亮。,淡妝濃抹,妝：妝飾。抹：塗抹。,,,
成群結隊,很多人聚集在一起，形成一個群體。,魚兒成群結隊的在珊瑚礁中穿梭游動，好看極了。,成群結隊,,,形單影隻,
洶湧澎湃,形容水勢很大，波浪互相撞擊，發出巨響。也比喻聲勢浩大。,這次颱風帶來驚人的風雨，海邊的浪潮洶湧澎湃。既壯觀，又讓人畏懼大自然的力量。,洶湧澎湃,,波瀾壯闊,風平浪靜,
聚精會神,指專心一致，集中精神。,許下承諾的隔天，安安學成語時，果然變得聚精會神。,聚精會神,,目不轉睛、全神貫注、專心致志,心不在焉、心猿意馬、魂不守舍,
形影不離,像身體和影子一樣不分離。形容彼此關係密切，經常伴隨，不能分離。,時間一天天過去，安安和坡坡成了形影不離的好朋友。,形影不離,,寸步不離、如影隨形、形影相隨,形單影隻、形影相弔,
防不勝防,做了很多準備，還是難以防備。,病菌無孔不入，令人防不勝防。,防不勝防,,,,
措手不及,事情發生太快，還來不及應付。,我軍深夜突襲敵軍陣地，打個敵軍措手不及。,措手不及,,,應付自如,
始料未及,指最初沒料想到。,這件事情會演變到這種地步，實在是始料未及。,始料未及,,,,
回心轉意,改變原來的態度和心意。,爸爸、媽媽和姊姊都很感激坡坡出手相救，終於回心轉意，考慮留下牠。,回心轉意,,,一意孤行、死心塌地、固執己見、執迷不悟,
皆大歡喜,大家都很滿意、高興。,家裡又多了一個新成員，全家皆大歡喜。,皆大歡喜,,,,
不約而同,沒有事先商量，而彼此的見解或行動相同。,大家不約而同的舉手，一致同意留下坡坡。,不約而同,,不謀而合,,
異口同聲,大家說出同樣的話，形容意見相同。,一家四口異口同聲的說：「我們來投票吧！」,異口同聲,,,眾說紛紜,
龍飛鳳舞,形容山勢蜿蜒雄壯。也形容書法筆勢飄逸活潑。,爺爺擅長書法，一手行草龍飛鳳舞。,龍飛鳳舞,,筆走龍蛇,,
雞鳴狗吠,雞和狗是人類常飼養的動物，若能聽到牠們的叫聲，代表此處是人群聚集的鄉村莊園。,這個小村莊炊煙裊裊，雞鳴狗吠，一派安靜祥和。,雞鳴狗吠,,雞犬相聞,,
驚弓之鳥,被弓箭嚇過而感到害怕的鳥。比喻曾受到事物打擊或驚嚇，往後稍有動靜就會特別害怕。,強烈地震後，大家都成了驚弓之鳥，稍有震動就會爭先恐後的往外跑。,驚弓之鳥,,心有餘悸,,
漏網之魚,逃脫漁網的魚。比喻僥倖逃脫。,刷牙一定要仔細，那些藏在牙縫中的菜渣很可能會成為漏網之魚。,漏網之魚,,,甕中之鱉,
害群之馬,危害馬群的個體。比喻危害團體的人。,智齒可能會讓整個口腔都不舒服，就像害群之馬。,害群之馬,,,,
膽小如鼠,像老鼠一樣膽小。形容膽子非常小。,妹妹聽了鬼故事之後，便不敢自己睡覺，真是膽小如鼠。,膽小如鼠,,,膽大包天,
如虎添翼,像老虎長了翅膀。比喻原本已相當優越的條件，在增加助力後更為強大。,表哥得到資深棋手的指導，短時間內棋藝進步神速，可謂如虎添翼。,如虎添翼,翼：翅膀。,錦上添花,雪上加霜,
如魚得水,好像魚兒到了水中一樣自在快活。形容遇到的人跟自己很投合或所處的環境和自己很適合。,他喜歡大自然，一回到山裡就如魚得水。,如魚得水,,,格格不入,
草長鶯飛,綠草茂盛，黃鶯飛舞。形容春天的美好景色。,春天的郊山草長鶯飛，風光明媚，讓人為之沉醉。,草漲英飛,長：生長。注意不要讀成「ㄔㄤˊ」。,,,
五顏六色,形容色彩多樣豐富。引申為各式各樣。,門前開著一大片五顏六色的鮮花，好美啊！,五顏六色,,五光十色,,
喜不自勝,高興到無法形容。非常高興的樣子。,,喜轐自生,,,,
信誓旦旦,誓言說得極其懇切，誠摯可信。,安安信誓旦旦的向媽媽保證，不會因為養狗而耽誤學業。,信誓旦旦,,,,
如釋重負,好像放下了沉重的擔子。形容解除負擔或擺脫困擾後，身心輕鬆愉快。,安安如釋重負，坡坡終於可以留下來了。,如釋重負,,,,
洗心革面,比喻徹底悔改或轉變。,為了表明自己的決心，安安決定洗心革面。,洗心革面,,,,
夜深人靜,夜已經深了，沒有人聲，非常安靜。,夜深人靜，家裡所有人都睡著了。,夜深人靜,,,,
約法三章,指事前的約束或規定。,月光照在床頭的一張紙上，那是安安和坡坡約法三章的規定。,約法三章,,,,
引人注目,形容人或事物具有特色，能引起他人注意。,他自學生時代起就展現出優秀的設計長才，身上的穿搭總是引人注目。,引人注目,注目：注視、注意。,,鮮為人知,
興致勃勃,形容興趣很濃厚。,他興致勃勃的攤開素描本，用畫筆為眼前美景留下永恆的回憶。,興致勃勃,勃勃：旺盛的樣子。,,興味索然,
錦上添花,在錦緞上繡花。比喻使美好的事物更加美好。,這次桌球比賽中，我們學校榮獲男女混雙組的金牌。錦上添花的是，連團體組都奪得總冠軍！,錦上添花,錦：一種有彩色花紋的絲織品。,,雪上加霜,
發憤圖強,下定決心，努力奮鬥自強。,不論古今中外，推動世界進步的科技發展背後，都少不了一群發憤圖強的科學家。,發憤圖強,圖：謀求。,,得過且過,
繁榮昌盛,指國家或事業經營成功且興盛。,唐太宗時，繁榮昌盛的局面被稱為「貞觀之治」。,繁榮昌勝,,,,
興高采烈,原指文章旨趣很高，文辭犀利。如今也用以形容人興奮歡快、情緒熱烈的樣子。,同學們正在興高采烈的討論下週的校外教學。,姓高采烈,興：興致。烈：旺盛。,興致勃勃,,
筋疲力盡,形容非常疲勞，力氣已經用盡。,農夫從中午一直忙到夕陽西下，返家時早已精疲力盡。,筋疲力盡,,,神采奕奕,
和顏悅色,溫和、愉快的臉色。形容態度溫和可親。,即使自己的心情再怎麼不好，他還是和顏悅色的對待周遭友人。,和顏悅色,顏：面容。色：臉色。,和藹可親,,
賞心悅目,因看到美好的情景或事物而心情愉快。,他的作業字跡整齊清秀，看起來賞心悅目。,賞心悅目,賞心：使心情歡暢。,心曠神怡,,
眉開眼笑,眉頭舒展，眼含笑意。形容高興愉快的神情。,張奶奶抱著剛出生的小孫子，高興得眉開眼笑。,眉開眼笑,,笑逐顏開,愁眉不展,
拭目以待,把眼睛擦亮等待著。比喻對事情的發展與結果有所期待。,坡坡對安安未來的表現拭目以待。,拭目以待,,,,
三心二意,形容人的心意不定，做事或態度猶豫不決。,安安一寫作業就開始三心二意。,三心二意,,,,
變本加厲,比喻改變原有的狀況後反而更加嚴重。,安安根本不理坡坡的提醒，反而變本加厲。,變本加厲,,,,
忍無可忍,形容忍耐到了極限，再也不能忍受。,坡坡忍無可忍，把紙飛機撕得粉碎。,忍無可忍,,,,
怒火中燒,怒氣如火焰在心中燃燒。形容極為憤怒。,坡坡怒火中燒，嚇了安安一跳。,怒火中燒,,,,
追根究柢,追查深究事情的根源。,「讀了這本又厚又重的書，又有什麼用呢？」小宇追根究柢的問著。,追根究柢,,,,
生機勃勃,生命力旺盛，充滿生氣活力。,各種大小昆蟲在草叢中或唱或跳，或者展翅飛翔、草上跳躍，到處生機勃勃。,生機勃勃,,朝氣蓬勃,氣息奄奄,
盡心竭力,費盡心思，用盡全身力氣。,為了下個月的園遊會，他盡心竭力準備擺攤的各種設備。,盡心竭力,盡心：用盡心力。,全力以赴,,
千山萬水,眾多的山岳、河流。比喻路途遙遠險峻。,他不怕山高路遠，無畏嚴寒酷暑，走遍了千山萬水。,千山萬水,,,,
搖頭晃腦,腦袋不停搖動。形容自認自己是正確的或自己樂在其中。,這本小說實在太有趣，子祈一邊搖頭晃腦的讀著，一邊連聲讚嘆。,搖頭晃腦,晃：晃動。,得意洋洋,,
張牙舞爪,原形容野獸的兇相。後比喻張揚作勢、猖狂凶惡的樣子。,敵人從山下張牙舞爪的衝了上來。,張牙舞爪,,齜牙咧嘴,喜眉笑眼,
眼明手快,目光銳利，動作迅速。形容做事機警敏捷。,如果想打好乒乓球，運動員必須具有眼明手快的本領。,眼明手快,疾：快。,,呆頭呆腦,
口乾舌燥,口舌乾渴。多指因說話太多而口渴。,音樂老師負責指導全年級的合唱，一天下來累得口乾舌燥。,口乾舌燥,,,,
五彩繽紛,形容色彩繁多豔麗。,春天的荒野中，百花盛開，嫩葉從枝頭爭先恐後的冒出，眼前一片五彩繽紛。,五彩繽紛,五彩：各種顏色。,五顏六色,,
搖搖欲墜,搖搖晃晃，就要墜落。形容極不穩固，就要傾倒。也比喻即將垮臺。,這顆搖搖欲墜的牙齒讓我感覺很不舒服。,搖搖欲墜,,危如累卵、岌岌可危、風雨飄搖,穩如泰山,
拍案而起,拍打桌面並突然站起。形容憤怒至極。,聞人質被撕票，警政署長拍案而起，怒不可遏。,拍案而起,,,,
勃然大怒,形容人大發脾氣的樣子。,得知兒子的荒唐行徑，父親勃然大怒，嚴加斥責。,勃然大怒,勃然：發怒衝動的樣子。,,,
大發雷霆,比喻大發脾氣，高聲責罵。,他這個人脾氣暴躁，只要一點小事不順心，就會大發雷霆，亂罵一通。,大發雷霆,霆：形容極響的雷聲。,怒不可遏、勃然大怒、暴跳如雷,心平氣和、平心靜氣、和顏悅色,
火冒三丈,形容十分生氣憤怒。,花錢還受罪，真教人火冒三丈。,火冒三丈,,,,
橫眉怒目,瞪大雙眼，豎起眉毛。形容滿臉怒容的樣子。,他生來就脾氣暴躁，動不動就橫眉怒目。,橫眉怒目,,,,
視而不見,儘管睜著眼睛，卻什麼也沒看見。表示不重視或假裝沒看見。,安安想方設法吸引坡坡的注意，坡坡仍然視而不見。,視而轐見,,,,
投其所好,迎合別人的喜好。,安安想用美食投其所好。,投其所號,,曲意逢迎、阿諛奉承、阿諛逢迎,剛正不阿,
正中下懷,恰好符合自己的想法。,安安在廚房裡找來找去，發現一盤紅燒肉，真是正中下懷！,正中下懷,,如願以償、稱心如意,大失所望、事與願違,
臭味相投,比喻性格、志趣相互投合。,坡坡原諒了安安，兩個臭味相投的好朋友又和好了。,秀味相投,,,,
春光明媚,形容春天的景色美麗多彩。,植樹節那天，春光明媚，老師帶我們在校園中種下小樹苗。,春光明媚,明媚：鮮明可愛。,,,
忐忑不安,指心裡七上八下，心神不寧。,小明打破了家裡的花瓶，覺得忐忑不安，深怕被爸媽責備處罰。,忐忑不安,忐忑：心神不寧。,坐立不安,,
五穀豐登,各種穀類作物大豐收。指收成好的豐年。,王叔叔用科學方法改良耕種方式，田地連年五穀豐登。,五穀豐登,五穀：指稻、豆類、麥、小米、高粱。泛指農作物。,,,
春華秋實,春天開花，秋天結果。比喻事物的因果關係。,他的學問如此淵博，全是靠著平日的努力不懈，可說是春華秋實。,春花秋實,華：同「花」，指開花。,,,
爭先恐後,爭著向前，唯恐落後。,馬路上趕著上班上學的車潮一見綠燈亮起，紛紛爭先恐後的起步往前。,爭先恐後,,力爭上游,畏縮不前,
七上八下,形容心情起伏不定、心神不寧。,小恩交出數學考卷後發現漏寫了好幾題，心情整天總是七上八下，擔心自己的成績。,七上八下,,心神不定、六神無主、如坐針氈、坐立不安、忐忑不安、惴惴不安,心安神泰、泰然自若、泰然處之,
喜怒哀樂,喜悅、憤怒、哀傷、快樂。泛指人的各種情緒。,在很多童話故事中，植物、動物不但能說話，也和人一樣有喜怒哀樂。,喜怒哀樂,,悲歡離合,,
不可思議,原為佛教用語，指言語思維不能達到的神祕境界。後指出乎常情，令人難以想像、不能理解。,我們可以從童話情節中認識許多奇特的朋友，經歷不可思議的旅程，還能獲得很多啟示。,不可思議,議：意見、言論。注意不要寫成「義」。,匪夷所思、難以置信,可想而知、合情合理,
寸步難行,形容走路非常困難。也形容處境非常艱難。,今早出門時剛好碰到塞車，我們困在車陣中寸步難行。,寸步難行,寸步：指極短的距離。,步履維艱,,
妙不可言,形容奇妙到了極點，無法用言語表達。,在童話王國裡，什麼都有可能發生，一切都妙不可言。,妙不可言,,,,
大失所望,指希望全部落空，感到非常失望。,沒想到這碗紅燒肉超級難吃，安安和坡坡大失所望。,大失所望,,,,
情投意合,形容雙方心意感情相契合。,他們兩人都喜歡看同一種題材的電影，所以才剛認識便一拍即合。,情投意合,,心心相印、同心合意、志同道合、意氣相投,同床異夢、格格不入、貌合神離,
一拍即合,一打拍子就對上了曲子的節奏。比喻同類型的人事物易湊合在一起。,他們兩人都喜歡看同一種題材的電影，所以才剛認識便一拍即合。,義拍即合,,,,
不謀而合,沒有事先商量，而彼此見解或行動就能一致。,當經理要我們推薦理想人選時，我們不謀而合地說出同一個人的名字。,不謀而合,,不約而同,,
志同道合,彼此的想法和興趣一致。,每逢假日，幾個志同道合的朋友小聚，真是人生一大樂事。,志同道合,,情投意合、意氣相投,不相為謀、扞格不入、同床異夢、貌合神離,
心照不宣,雙方明瞭彼此想法，不須開口。,他們倆共事已久，許多事往往心照不宣，便能彼此默契，相互配合處理完善。,心照不宣,,心知肚明、心照神交、心領神會,,
滿口答應,表示毫無保留的完全應允。,老師推薦安安代表學校參加校際盃成語比賽，安安想也不想就滿口答應。,滿口答應,,,,
後悔莫及,事後懊悔，已經來不及補救挽回了。,安安對自己的所作所為後悔莫及。,後悔莫及,,,,
多行不義必自斃,壞事做多了，一定會自取滅亡。,民間故事大多善惡分明，惡人往往多行不義必自斃。,多行不義必自斃,斃：死。,自取滅亡,,
適可而止,指事情做到恰到好處就該停止。,想維持健康的身體，不論是運動或飲食都應適可而止，才不會對身體造成負擔。,適可而止,,,過猶不及,
碩大無朋,大得無法與之相比。形容極大。,他栽種芒果時施加了特別的肥料，並且悉心照顧，收成的芒果果實和一般市售的尺寸比起來，真是碩大無朋。,碩大無朋,碩：大。朋：比。,,小巧玲瓏,
心馳神往,形容心神專注、一心嚮往於某事物。,這本小說中描述的和平與安樂生活，讓人心馳神往。,心馳神往,馳：嚮往。注意不要寫成「弛」。,,,
顧影自憐,望著自己的影子，自己憐惜自己。也指看著自己美好的形象，自我欣賞。,身為籃球校隊的哥哥身材高挑、長相帥氣，平常總愛在鏡子前面顧影自憐，非常滿意自己的外表。,顧影自憐,顧：看。,孤芳自賞(自我欣賞之意),,
淚如泉湧,眼淚像泉水一樣湧出。形容極其悲痛。,一說到傷心處，她禁不住淚如泉湧。,淚如泉湧,,淚如雨下,,
潸然淚下,形容哀傷落淚的樣子。,看著銀幕上訣別的場面，她不禁潸然淚下。,潸然淚下,潸然：流淚的樣子。,,,
泣不成聲,哭得無法發出聲音。形容極度悲傷。,聽到好友過世的消息，他泣不成聲。,泣不成聲,,,,
痛哭流涕,形容非常傷心。,看到自己辛苦經營的事業毀於一旦，他不禁痛哭流涕，傷心欲絕。,痛哭流涕,涕：眼淚。,,,
欲哭無淚,想哭卻哭不出來。比喻極度哀痛或無奈。,眼看著一年的辛勞在一場暴風雨下化為烏有，果農們個個哀聲嘆氣，欲哭無淚。,欲哭無淚,,,,
車水馬龍,形容車馬往來不絕，非常繁華熱鬧。,坡坡穿過車水馬龍的大街，來到碼頭。,車水馬龍,,門庭若市、肩摩轂擊、熙來攘往、熙熙攘攘,門可羅雀,
飄洋過海,渡過海洋。指遠離家鄉，前往異國。,坡坡飄洋過海，想要遠離安安居住的城市。,飄洋過海,,,,
翻山越嶺,翻越過一座又一座山嶺。形容長途跋涉的艱辛。,坡坡翻山越嶺，堅定的朝著目的地前進。,翻山越嶺,,,,
一覽無遺,一眼就將情勢或景物全看在眼裡，毫無遺漏。,坡坡登上了一座高山，眼前的風景一覽無遺。,義覽無遺,,,,
從天而降,從天上突然落下。形容突然出現，令人難以置信。,忽然，一隻烏鴉從天而降，還扔下一塊金牌。,從天而降,,,,
歷歷在目,清楚明白的呈現在眼前。,坡坡看著金牌陷入回憶，和安安許下諾言的情景歷歷在目。,歷歷在目,,歷歷可見,霧裡看花,
一無所獲,什麼都沒有得到。,老漁夫獨自一人出海捕魚，一連數日都一無所獲。,義無所獲,,兩手空空,滿載而歸,
念念有詞,舊指道士僧侶口中念咒或念經。現多指低聲自語，或含糊不清的說個不停。,明天的大考攸關學期成績，他念念有詞的默記公式，連爸爸叫他吃晚餐都沒聽到。,念念有詞,念唸：誦讀。,喃喃自語,,
忘其所以,形容因過度興奮得意而失去常態。,他們結婚已久，終於盼得第一個孩子平安出生，兩人高興得忘其所以。,望其所以,,得意忘形,,
兩手空空,手裡完全沒有一毛錢或任何東西。形容一無所有。,他從年輕起沉迷於賭博，敗光了所有家產，最後落得兩手空空，甚至無家可歸。,兩手空空,, ,滿載而歸,
心滿意足,形容心理非常滿足如意。,弟弟收到了心愛的生日禮物，心滿意足的笑了。,心滿意足,,稱心如意,大失所望,
化為烏有,變得什麼都沒有了。指全部消失或完全落空。,只要投入媽媽溫暖的懷抱，他就覺得剛才受到的委屈立刻化為烏有。,化為烏有,化：改變。烏有：虛無、沒有。,,,
滄海一粟,大海裡的一顆穀粒，形容非常渺小而微不足道。,銀河系對宇宙來說，只不過是滄海一粟。,滄海宜粟,粟：穀子。注意不要寫成「栗」。,九牛一毛、、微不足道、微乎其微,盈千累萬,
寒風刺骨,寒冷的風刺入骨髓。形容極度寒冷。,這週適逢寒流來襲，走在戶外只覺得寒風刺骨，讓人實在沒有想出門的動力。,寒風刺骨,,冰天雪地,,
繪聲繪影,形容講述或描繪事物，非常深刻入微且逼真。,歷史老師擅長把課文幻化為生動的故事，繪聲繪影之餘還不忘引導學生思辨真相，成為我們班最受歡迎的一堂課。,繪聲繪影,,栩栩如生,,
風光旖旎,形容景色柔和美好。,春天的植物園風光旖旎，處處都有紅花綠葉、蟲鳴鳥唱，讓人心曠神怡。,豐功旖旎,旖旎：柔媚的樣子。,,,
鱗次櫛比,像魚鱗和梳齒般緊密有序的排列著。多用來形容房屋或船隻密集。,次：排列。櫛：梳子、篦子（細齒梳）的總稱。,鱗次櫛必,,,,
萬家燈火,形容繁榮城鎮夜晚燈火通明的景象。,,萬家燈火,,,,
通都大邑,四通八達的繁華大都市。,,通督大義,,,,
車馬輻輳,形容車馬眾多，非常擁擠。,,車馬輻輳,,,,
川流不息,像河水般流個不停，形容連綿不絕或往返不斷。比喻來往的人、車輛或船隻很多。,今天想寫作的心情特別強，腦筋裡的靈感如川流不息般地浮現。,川流不息,,車水馬龍、絡繹不絕、熙來攘往,稀稀落落,
孤芳自賞,把自己當作獨特不凡的香花而自我欣賞。比喻自命清高，自我欣賞。,如果每個人讀書後都只會關起門來孤芳自賞，這個世界又怎會進步呢？,孤芳自賞,孤芳：一枝獨秀的香花。,顧影自憐,,
居高臨下,占據高處，俯向低處。形容處於有利的地勢或地位。,老鷹隨著上升氣流振翅一飛，瞬間攀到高空中，居高臨下的眺望地表萬物。,居高臨下,居：站在，處於。臨：面對。,,,
粉身碎骨,身體碎成粉末。指喪失生命，也比喻為了目的而獻身。,面對敵人來襲，全體士兵都抱著粉身碎骨的覺悟，立志一定要保衛國家與人民。,粉身碎骨,,肝膽塗地,,
氣壯山河,形容氣勢像高山大河般雄偉豪邁。,電影生動重現了古代三國演義的戰爭場景——只見關羽登高一呼，氣壯山河，士兵們莫不提起精神，奮勇作戰。,氣壯山河,,氣勢磅礴,有氣無力,
望風披靡,草木隨風伏倒。形容被強大的氣勢所壓倒。,在生活困苦的年代，奶奶不但養活了一家人，甚至靠自學苦讀獲得學位，在家族間望風披靡，人人都欽佩不已。,望風披靡,披：拆裂、去除。靡：順勢倒下。,,,
同舟共濟,同坐一條船過河。比喻在困境中同心協力，克服困難。,這場比賽十分驚險，多虧所有球員發揮了同舟共濟的團隊精神，終於贏得勝利。,同舟共濟,,同心同德、同心協力、同甘共苦、休戚與共、禍福與共,分崩離析、同床異夢、離心離德,
各司其事,各自負責做好自己的本職工作。,在大專案中，只有團隊成員各司其事，才能發揮最高的效率。,各司其事,司：掌管。,,,
同甘共苦,共同享受歡樂幸福，共同承擔禍患苦難。,臺灣這幾十年來的成就是全國同胞同甘共苦所換來的。,同甘共苦,,,,
眾志成城,眾人同心協力，力量有如堅固的城牆。比喻團結一致就能形成強大的力量。,在當前外交情勢窘迫之際，國人更應抱持眾志成城的意念，突破困境。,眾志成城,城：城牆。,萬眾一心,一盤散沙,
群策群力,集合眾人的智慧和能力。,災區重建不單是地方政府的事，得由所有相關單位群策群力，克服一切困難來完成。,群策群力,,同心協力、畢力同心,一意孤行、孤行己見、孤軍作戰、單打獨鬥、單槍匹馬、獨斷專行,
